Title,Text,Tag,Days_Left,Price,Total Bids ,Url
Need a commercial interior designer,I have an asian restaurant and looking for ideas to re-design the interior.,Building Architecture,6 days left,$941 Avg Bid,38 bids,https://www.freelancer.com/projects/threed-modelling/need-commercial-interior-designer/
High-end Precast Concrete Engineering,"Can you design Precast Concrete House with precast floors and walls and find out the logistics of delivering the precast concrete to anywhere in Europe. Please show a technical precast wall drawing that can be sent to factory for manufacturing. The technical drawing should not only contain dimensions, but also the concrete strength class and rebar requirements meeting the Eurocode standards.",Building Architecture,6 days left,$52777 Avg Bid,2 bids,https://www.freelancer.com/projects/building-architecture/high-end-precast-concrete-engineering/
Experienced Precast Concrete Engineer....,"Can you design Precast Concrete House with precast floors and walls and find out the logistics of delivering the precast concrete to anywhere in Europe. Please show a technical precast wall drawing that can be sent to factory for manufacturing. The technical drawing should not only contain dimensions, but also the concrete strength class and rebar requirements meeting the Eurocode standards.",Building Architecture,6 days left,$402 Avg Bid,4 bids,https://www.freelancer.com/projects/building-architecture/experienced-precast-concrete-engineer/
3D rendering for office building,i need the best of the best top rendering of a new 5 story office building exterior & interior i have my floor plans & elevations on revit & cad thank you,Building Architecture,6 days left,$485 Avg Bid,59 bids,https://www.freelancer.com/projects/threed-modelling/rendering-for-office-building/
house plans,I am planing to build a house in Ottawa Ontario. I need the plans drawn to meet the city regulations,Building Architecture,6 days left,$1342 Avg Bid,32 bids,https://www.freelancer.com/projects/building-architecture/house-plans-19594417/
Logo needed for Global Meeting,"I am looking for a freelancer to create a logo for our global meeting that is taking place in Greece in early April. We might also be interested in a powerpoint template to go along with the logo (to be determined). A theme has been determined, so we just need someone to bring it to life for us. Please send examples of logos for meetings that you have created before in your cover letter if possi...",Building Architecture,6 days left,$387 Avg Bid,21 bids,https://www.freelancer.com/projects/mobile-phone/logo-needed-for-global-meeting-19594420/
"Cabinet, Concrete, and Steel Shop Drawings","Hi, I am looking for help with shop drawings for cabinetry, concrete/rebar, and structural steel. Please read the entire description so we are not wasting each other's time. A few requirements: - fluent english -- prefer North American time zones. Anywhere between pacific and east coast - NEEDS to be in Revit - You must have good experience What I need to see: - one or two of your best...",Building Architecture,6 days left,$327 Avg Bid,22 bids,https://www.freelancer.com/projects/threed-modelling/cabinet-concrete-steel-shop-drawings/
Design a Master Bedroom,"I would like a nice design in 2d or 3d for a beautiful bedroom with 2 full-size beds 54"" & a love seat. The size of the bathroom space is 180"" x 136.8"" Inch. (15 x 11.4 foot) See attached a drawing of the room We would like to add these or similar headboard [login to view URL] feel free to ask any questions you may have.",Building Architecture,29 days left,$25,0 entries,https://www.freelancer.com/contest/design-a-master-bedroom-1501153.html
3d design architecture,landscaping 3d design architecture,Building Architecture,6 days left,$110 Avg Bid,30 bids,https://www.freelancer.com/projects/threed-modelling/design-architecture/
Jewelry Auto CAD Designer in Los Angeles Area,Looking for someone to work inhouse to modify our design work that we have on AutoCad . We are located in city of commerce and we are starting interviews this week to start working either this week or next week. Must work at our business office.,Building Architecture,6 days left,$19 / hr Avg Bid,5 bids,https://www.freelancer.com/projects/building-architecture/jewelry-auto-cad-designer-los/
Interior design for home,I would like to hire an interior designer to design my house.,Building Architecture,6 days left,$419 Avg Bid,56 bids,https://www.freelancer.com/projects/rendering/interior-design-for-home-19592822/
CAD designer to create a 3D model of a residential building,Add value to your project with realistic visuals. Aesthetic architectural visualization. Functional Realistic Designs. Reasonable price.,Building Architecture,6 days left,$13 / hr Avg Bid,43 bids,https://www.freelancer.com/projects/threed-modelling/cad-designer-create-model-residential-19591083/
Interior Designer,"I have a new 3 BHK apartment in Kukatpally, Hyderabad and I am looking for good designers.",Building Architecture,6 days left,$2408 Avg Bid,17 bids,https://www.freelancer.com/projects/threed-modelling/interior-designer-19590051/
Project Structure in Visual Studio for Autocad 2016 ARX written in C++,"Hi there, we have a project written in C++ that build a file . arx. This .arx load on Autocad 2016 return error because header and include was for Autocad 2002. What we need is a simple project that can buil an .arx with Autocad 2016, I will give a couple of routine written in C++ to copy inside a class. Some building test and support after release. Thanks",Building Architecture,6 days left,$190 Avg Bid,9 bids,https://www.freelancer.com/projects/cplusplus-programming/project-structure-visual-studio-for/
All Cast J7736,"Northern Territories leading precaster requires shop drawings for a new commercial warehouse incorparating alterations to existing structures. The drawings will be for the precast components including marking plans, dowel plans, elevations and individual panel shop drawings. The drawings need to be similar to the sample attached.",Building Architecture,6 days left,$645 Avg Bid,10 bids,https://www.freelancer.com/projects/autocad/all-cast/
Home Bunglow Construction,"The project is situated at Neemuch Madhya Pradesh, we are looking to build a Four Bedroom bunglow with Garage shop in 3600 Squarish Plot",Building Architecture,6 days left,$321 Avg Bid,28 bids,https://www.freelancer.com/projects/rendering/home-bunglow-construction/
"Licensed Professional Engineer or Architect in MD, approve site plan and stamp.","Review, approve and stamp the following site plan.",Building Architecture,6 days left,$375 Avg Bid,2 bids,https://www.freelancer.com/projects/engineering/licensed-professional-engineer-architect-19587234/
I need interior draftsman,I need design my one page wabesite,Building Architecture,5 days left,$131 Avg Bid,20 bids,https://www.freelancer.com/projects/rendering/need-interior-draftsman/
Do the interior design for my new home,"Im building new home and i want you to do the interior design and suggestions for the ground floor ( stairs, floor and walls, lighting distribution, furnitures, etc..) and to provide me with 3D pictures for how the interior of the home will be finally. I attached the plan for the ground floor",Building Architecture,5 days left,$952 Avg Bid,86 bids,https://www.freelancer.com/projects/threed-modelling/the-interior-design-for-new/
Building plans for detached garage,"Looking to build a basic 23x25 detached garage, with a double garage door, single exterior door, and electricity. No windows, no AC, no water. I have attached a basic layout of plan, but need actual plans to start contractor process. How much, and length of time needed, for code-legal plans?",Building Architecture,5 days left,$318 Avg Bid,37 bids,https://www.freelancer.com/projects/autocad/building-plans-for-detached-garage/
Looking for a structural Engineer in California,We have a couple of projects in Los Angeles and San Diego area. We want someone to make site visits and offer consultations. I'm looking for someone with structural engineering / construction experience to be able to take on such tasks. You do not have to be a licensed PE but it is preferred. Please connect to discuss details.,Building Architecture,5 days left,$29 / hr Avg Bid,6 bids,https://www.freelancer.com/projects/autocad/looking-for-structural-engineer-19585584/
Exterior Remodel Design,"I am in the process of planning a complete exterior remodel of my house. It is a 2 story brick colonial with an attached 2 car garage. New windows, fascia, gutters, soffits, cleaning of the brick facade and changing color of brick, and installing limestone lintels and sills on each window. Also new stone veneer on the bottom front elevation, new garage doors and entry doors. I have a pretty good ...",Building Architecture,5 days left,$416 Avg Bid,71 bids,https://www.freelancer.com/projects/rendering/exterior-remodel-design/
Chief Architect software projetc,"This project is to make working drawings/construction documentation using the software ""Chief Architect"" Please only apply if your have experience on this software.",Building Architecture,5 days left,$4 / hr Avg Bid,3 bids,https://www.freelancer.com/projects/threed-modelling/chief-architect-software-projetc/
Gazebo design for terrace,Required a gazebo design with structural drawing.,Building Architecture,5 days left,$17 Avg Bid,10 bids,https://www.freelancer.com/projects/building-architecture/gazebo-design-for-terrace/
Logo needed for Global Meeting,"I am looking for a freelancer to create a logo for our global meeting that is taking place in Greece in early April. We might also be interested in a powerpoint template to go along with the logo (to be determined). A theme has been determined, so we just need someone to bring it to life for us. Please send examples of logos for meetings that you have created before in your cover letter if possi...",Building Architecture,5 days left,$306 Avg Bid,19 bids,https://www.freelancer.com/projects/mysql/logo-needed-for-global-meeting-19584025/
Landscaping,"I need landscaping complete planning, 3d model and rendering. Regarding example, it's simpler for me to explain what we like. we like hi-tech, industrial, rustic and modern design. I will send pics of the actual garden to let you understand our environment. it's doesn't matter what we have today so feel free to change the existing disposition unless the house. we want: - deck+bomini...",Building Architecture,5 days left,$151 Avg Bid,27 bids,https://www.freelancer.com/projects/threed-modelling/landscaping-19581875/
Home design from front view,I want 3d model house design from front,Building Architecture,5 days left,$27 Avg Bid,19 bids,https://www.freelancer.com/projects/building-architecture/home-design-from-front-view/
3d model of apartment for GTA V,"I require a Model of a single bedroom apartment with a bathroom attatched, the apartment must have a double bed, wardrobe, chest of drawers, a desk with a laptop / computer and a bathroom attatched too The apartment must have proper collisions and lighting. It is required to be imported as a single object into GTA V with the model and texture files being YDR and YTD files. Please do not post s...",Building Architecture,5 days left,$120 Avg Bid,21 bids,https://www.freelancer.com/projects/threed-modelling/model-apartment-for-gta/
Indian Target Market research and submit only data in a word document,"# Indian most 10 art lover individual profiles about their net worth & art collection # India's biggest 10 Govt. monumental project summary – made out of bronze, aluminum (Project-cost-builder etc.) # All India sculpture market demand SUMMARY – not so detailed statistics (Annually) # All India Bronze made architectural products (Doors, windows, balcony, stair railings) dema...",Building Architecture,5 days left,$49 Avg Bid,5 bids,https://www.freelancer.com/projects/research/indian-target-market-research-submit/
Website with products shareable with architect CAD programs,"Hi there, Am looking for someone to design and make a website. We would like stone/tile product images on website to be downloadable to local architects so they can include our product into their CAD, rhino, design programs. At this stage, I would like to collect quotations for this project. Looking to start website in next month. Thanks, Johanna",Building Architecture,5 days left,$435 Avg Bid,6 bids,https://www.freelancer.com/projects/threed-modelling/website-with-products-shareable-with/
Interior design for Cafe,"Looking for experienced freelancer with previous work completed in the hospitality industry. We need your creative eye and expertise to bring our vision to life. Please provide examples of past work. To better understand scope of the project, we would reach out for an initial chat. Style we’re after - Modern, minimal Thank you",Building Architecture,5 days left,$676 Avg Bid,80 bids,https://www.freelancer.com/projects/threed-modelling/interior-design-for-cafe-19580562/
Interior design residential new build,"Living space design including kitchens, bathrooms, utility room , living room, dressing rooms to be incorporated into a whole house dwg drawing.",Building Architecture,5 days left,$244 Avg Bid,62 bids,https://www.freelancer.com/projects/rendering/interior-design-residential-new-build/
Home plan and design,I need home plan design for my home .. Home plan should be clear with good plan...,Building Architecture,5 days left,$132 Avg Bid,59 bids,https://www.freelancer.com/projects/threed-design/home-plan-design/
Moon park condo,Structural Engineer Design in Cambodia,Building Architecture,5 days left,$16 / hr Avg Bid,6 bids,https://www.freelancer.com/projects/autocad/moon-park-condo/
Low Student accommodation plan design,Design of a low-cost student housing one level or two levels,Building Architecture,5 days left,$60 Avg Bid,22 bids,https://www.freelancer.com/projects/building-architecture/low-student-accommodation-plan-design/
Design a log cottage and prepare building plans,"I am looking to build a cottage with engineered logs (already have the necessary drawings for the wall system) and looking for an architect to help me with the design (have a very good idea and sample plans) and prepare detailed construction drawings/plans to obtain a building permit, as well as to provide to subcontracts for quotes.",Building Architecture,5 days left,$747 Avg Bid,28 bids,https://www.freelancer.com/projects/autocad/design-log-cottage-prepare-building/
External Works and Drainage for New Building,"A new Drainage system is required for a New Leisure, Art Gallery linked to Watts Building with integrated Carpark. 3 DAY DEADLINE! 35+ Pages required Work template (must include) Introduction / Layout / Conclusion 10% Design Method Statements 30% Tabulated Method Statements 20% Descriptive Method Statements 10% Programme/Planning (Gantt Chart) 10% Application of Health, Safety & Welfare know...",Building Architecture,4 days left,$120 Avg Bid,5 bids,https://www.freelancer.com/projects/building-architecture/external-works-drainage-for-new-19576154/
Farmhouse with the backward pool,"I want to build a 2000 square feets farmhouse with a small pool backward in a .51 acre coffee plantation. I m planning to use 6000 square feets land for the building, pool, landscapes and parking. I am planning to build a surrounding wall height of 5 feets to give privacy. The building should be have rain water harvesting and pool with water treatment plant. The building should be duplex. I want k...",Building Architecture,4 days left,$415 Avg Bid,25 bids,https://www.freelancer.com/projects/threed-modelling/farmhouse-with-the-backward-pool/
sketchup specialist to create 3d views from 2d plans,"We are looking for a long term relation with a architect, an interior designer, or a 3D specialist expert in sketchup, that could transform 2d plans and cutting plans into 3d. The more often, il will be empty apartments, but we could ask to furnish it as well.",Building Architecture,4 days left,$10 / hr Avg Bid,80 bids,https://www.freelancer.com/projects/threed-modelling/sketchup-specialist-create-views-from/
Autocad Architecture,"Need House Design Plan , 2d and 3d view in Autocad",Building Architecture,4 days left,$97 Avg Bid,56 bids,https://www.freelancer.com/projects/autocad/autocad-architecture-19573702/
Design exterior of house (modern style / funkis),"Hi, We are building a house (partial renovation, partial new build). Currently, we have the floor plans of the house, and would like some sketches of what the exterior could look like. 9 example photos are included for inspiration. We are looking for a modern style with clean lines (functional style/funkis) and a flat roof. In particular we want to keep a concept of parallel lines running al...",Building Architecture,4 days left,$50,6 entries,https://www.freelancer.com/contest/design-exterior-of-house-modern-style-funkis-1500173.html
2 storey house floorplan,"Hello, I have an initial floorplan i need to change few things on. I also need 3d floorplan and elevation. I have a very small budget because the house is small and simple.",Building Architecture,4 days left,$41 Avg Bid,54 bids,https://www.freelancer.com/projects/threed-modelling/storey-house-floorplan/
I need an interior designer,Its an under construction builder floor. Delivery due in July. We want help regarding the interiors. Layout attached,Building Architecture,4 days left,$133 Avg Bid,30 bids,https://www.freelancer.com/projects/rendering/need-interior-designer-19573405/
Looking for content writer for architectural firm,I need you to write some content for a website.,Building Architecture,4 days left,$29 Avg Bid,8 bids,https://www.freelancer.com/projects/content-writing/looking-for-content-writer-for-19573303/
4Bhk Bungalow 3D views.,"I need someone to create 3D design for my 4 BHK bungalow. High resolution images of each side elevation as per floor plan attached below. My budget is less so please don't ask to increase the price for the same. Also i have uploaded some reference images so you follow the same quality of work. If i liked the work we can settle down with long term work , as i have several projects in hand so l...",Building Architecture,4 days left,$142 Avg Bid,30 bids,https://www.freelancer.com/projects/threed-modelling/bhk-bungalow-views/
PROPOSED ERECTION OF SPORTS HALL AND AUDITORIUM- ID Design with AutoCAD and SKETCH UP,Freelance Design to design 3D *Sketch Up based on the 2D layout from AutoCAD I need only European or American. Don't apply Asia,Building Architecture,4 days left,$17 / hr Avg Bid,19 bids,https://www.freelancer.com/projects/threed-modelling/proposed-erection-sports-hall-and/
9 Villas compound Interior & Exterior,"9 villas compound (2 types repeated) 3d rendering for exterior elevation with wide view for the compound and material selection Conceptual design with 3d rendering and material selection for interior concept plan for master plan with material selection Detailed drawings are optional and to be later This job was posted from a mobile device, so please pardon any typos or any missing details.",Building Architecture,4 days left,$342 Avg Bid,46 bids,https://www.freelancer.com/projects/threed-modelling/villas-compound-interior-exterior/
"AutoCAD, Building Architecture Expert needed ... - 16/03/2018 00:28 EDT -- 3","I need the AutoCAD, Building Architecture expert freelancer for my current project. Details will be shared with winning bidder. Please bid if you have the experience.",Building Architecture,4 days left,$44 Avg Bid,31 bids,https://www.freelancer.com/projects/illustration/autocad-building-architecture-expert-19571972/
"DGN,DWG html viewer","I have dwg, dxf and dgn, files and I would like to view this file through the web. If anyone has the experience to do this please contact me. Please take look below sites before giving proposals. [login to view URL] [login to view URL] Thank You.",Building Architecture,4 days left,$47 Avg Bid,5 bids,https://www.freelancer.com/projects/html/dgn-dwg-html-viewer-19571925/
Sketch of an interior,"Hello, I would like to have the drawing of an interior in sketch form. See the bar photo, that is what I would like sketched up. Also find attached the a Sketch samples, showing the drawing quality I'm looking for. I would like it in high quality for print. Please can you send examples of your work so I can see. Many thanks.",Building Architecture,4 days left,$138 Avg Bid,17 bids,https://www.freelancer.com/projects/autocad/sketch-interior/
Augmented reality for ruined building to look like new.,We have an old water mill that is currently a ruin. We want tourists to be able to use their smartphones to envisage what the site would have looked like 100 years ago. Pan the phone around and see the water wheel turning and boats coming up the river. Walk inside the building and see inside. We have many old photographs but some images will need to be created from scratch. There is no internet av...,Building Architecture,4 days left,$1836 Avg Bid,28 bids,https://www.freelancer.com/projects/graphic-design/augmented-reality-for-ruined-building/
Construction Estimate Comparison,I am an adjuster looking for help with a Scope and Cost Analysis Spreadsheet,Building Architecture,3 days left,$343 Avg Bid,19 bids,https://www.freelancer.com/projects/excel/construction-estimate-comparison/
garden landscape design,need an garden and landscape designer for home.,Building Architecture,3 days left,$204 Avg Bid,32 bids,https://www.freelancer.com/projects/building-architecture/garden-landscape-design/
Building Estimator,Seeking someone with experience using Databuild to conduct estimations for townhouse projects in Melbourne. Starting with 1. Kindly provide a fixed price quote per 5 unit project.,Building Architecture,3 days left,$303 Avg Bid,21 bids,https://www.freelancer.com/projects/autocad/building-estimator-19566014/
1/88 safderjung delhi project,"This is a resident project with all details like toilet, modular kitchen, cupboard, etc. this project is make building 4 floor with ground parking & give a lift for reach all floor accounting to client. See same pic of this project.",Building Architecture,3 days left,$88 Avg Bid,11 bids,https://www.freelancer.com/projects/threed-modelling/safderjung-delhi-project/
Prospective list for sales development (Germany),"Basically, large machines and equipment are needed in the construction. Whether it is a steel or metal construction, civil engineering or hall construction, the use of working platforms facilitates the work process. Work platforms are construction equipment that is mostly needed for repair or maintenance. They serve the specialist as a safe working area and, if they have a large area, can also ser...",Building Architecture,3 days left,$184 Avg Bid,14 bids,https://www.freelancer.com/projects/data-entry/prospective-list-for-sales-development/
Hand drawn seating plan (multiple winners!),"For my website I need many hand-painted seating plans of weddings, birthday parties, theatres, cinemas and the like. Tables: 5-15 Chairs: 20 to 200 Color: Colors are welcome, but keep it simple! Size: It can be the size of a Post-it, Din A5, DIN A3, a napkin, anything someone could draw a seating plan on. It should also contain things like stage, screen, buffet, as if they were real plans of re...",Building Architecture,11 days left,$11,66 entries,https://www.freelancer.com/contest/hand-drawn-seating-plan-multiple-winners-1499824.html
Office interior design for Chicago startup,Growing healthcare supply startup needs interior design for its new home in Chicago. ~700 sf common area (entrance/lounge/kitchen) ~1200 sf office area 1960’s style office building with brick and black terrazzo floors in common area. Vanilla box office area.,Building Architecture,3 days left,$1945 Avg Bid,60 bids,https://www.freelancer.com/projects/threed-modelling/office-interior-design-for-chicago/
Logo Design,Z-Co. Modular is a modular building construction company selling pre-fabricated buildings to the consumer.,Building Architecture,3 days left,$100,92 entries,https://www.freelancer.com/contest/logo-design-1499785.html
Interior design,We are a start-up who have just kicked off... One project already done with complete customer satisfaction and customisation... We have protects lining up and we thought we need to expand our contacts with skilled and reasonable carpenters...,Building Architecture,3 days left,$5482 Avg Bid,14 bids,https://www.freelancer.com/projects/threed-modelling/interior-design-19557557/
Rework Flooplan,Hi! I am looking for a designer who is able to take 16 architectural floorplans and turn them into a more appealing branded floorplan! Sample work will need to be provided! Thank you!,Building Architecture,3 days left,$404 Avg Bid,88 bids,https://www.freelancer.com/projects/graphic-design/rework-flooplan/
Fresh water and waste water system for old house Europe,"Hello, I am looking for engineer to design, make simple drawings and bill of material for simple small house fresh/waste water systems. Designer HAVE TO BE FROM EUROPE (as using european components and metric parts etc). Do not bid if outside EU. Attached is picture of house. BR, H",Building Architecture,3 days left,$137 Avg Bid,5 bids,https://www.freelancer.com/projects/building-architecture/fresh-water-waste-water-system/
PDMS Freelancers or employees,Hello we are an engineering company looking for Freelancers or employees for a project in Europe for at least 1 year. we want professional PDMS Piping Designers. we are interested more in people who can work in Europe and have already working Visa or Citizenship Feel free to contact me and share with me your Cvs thank you,Building Architecture,3 days left,$45 / hr Avg Bid,13 bids,https://www.freelancer.com/projects/engineering/pdms-freelancers-employees/
