Title,Text,Tag,Days_Left,Price,Total Bids ,Url
proposed office designed for victoria enclave in chandigarh,"office designed for victoria enclave in chandigarh with all the eletrical, flooring, main door, washroom plan, all the pffs are uploaded..",Building Architecture,3 days left,$30 / hr Avg Bid,9 bids,https://www.freelancer.com/projects/graphic-design/proposed-office-designed-for-victoria/
landscape architect design,"would like an outdoor landscape design, Please note I want a full high end design for the whole landscape similar to the designs that Fluid designs can make. Please check their website first and feel free to rebid and sent examples of your work or instagram account etc. The design have to be able to be built in real life. [login to view URL]",Building Architecture,3 days left,$293 Avg Bid,50 bids,https://www.freelancer.com/projects/threed-modelling/landscape-architect-design/
Redesign a house,Please tell me what's wrong with a given building and how you can improve the design.,Building Architecture,2 days left,$1674 Avg Bid,51 bids,https://www.freelancer.com/projects/graphic-design/redesign-house/
Garden Design Sketchup Artist For Frequent Work,i am looking for an artist who specialises in garden design. I am an experienced landscape gardener who is venturing into design. i would like to be able to send images of small - large gardens including town and country gardens. I will provide a brief of what the client is looking for in their specific garden and dimensions if needed. There will be frequent work from this as i have clients ready ...,Building Architecture,2 days left,$204 Avg Bid,29 bids,https://www.freelancer.com/projects/threed-modelling/garden-design-sketchup-artist-for/
Room Addition,Looking to have a room addition with 2 bedroom/ bath/ family room with deck porch built onto a park model home,Building Architecture,2 days left,$364 Avg Bid,46 bids,https://www.freelancer.com/projects/threed-modelling/room-addition/
Building Plan,"I am looking for Building plans and drawings, I have a open plot 36 X 50 size (200 Sq Yards) East Facing Plot. I am planing G+3 floors",Building Architecture,2 days left,$117 Avg Bid,36 bids,https://www.freelancer.com/projects/threed-modelling/building-plan-19500426/
Architect plan,"1. Site development plan of the project 2. Landscape plan and plant list of the project 3. Exterior elevation plan streetscape view ( north, south, east, west) with spec of finishing material ( wood , stone) 4 streetscapes height analysis with google of subject and adjacent properties. 5. plan for interior 6. construction plan for zoning approval Lot size:24000 SQF house size:6000 SQF",Building Architecture,2 days left,$393 Avg Bid,47 bids,https://www.freelancer.com/projects/autocad/architect-plan/
Architectural drawing and 3D rendering,"3d color rendering ( from street view, aerial view, back yard view) 1.1 picture of various street view of existing property and surrounding neighborhood including aerial view. 2. Site development plan of the project 3. Landscape plan and plant list of the project 4. Exterior elevation concept plan streetscape view ( north, south, east, west) with spec of finishing material ( wood , stone) 4.1 st...",Building Architecture,2 days left,$893 Avg Bid,76 bids,https://www.freelancer.com/projects/rendering/architectural-drawing-rendering/
External Works and Drainage for New Building,"A new Drainage system is required for a New Leisure, Art Gallery linked to Watts Building with integrated Carpark. 3 DAY DEADLINE! 35+ Pages required Work template (must include) Introduction / Layout / Conclusion 10% Design Method Statements 30% Tabulated Method Statements 20% Descriptive Method Statements 10% Programme/Planning (Gantt Chart) 10% Application of Health, Safety & Welfare know...",Building Architecture,2 days left,$174 Avg Bid,13 bids,https://www.freelancer.com/projects/building-architecture/external-works-drainage-for-new/
4 High Quality Photorealistic Architectural Renderings -- 2,"4 interior common areas with finishes, materials and furniture as specified. 2 week timeline. Please provide examples of work.",Building Architecture,2 days left,$345 Avg Bid,89 bids,https://www.freelancer.com/projects/threed-modelling/high-quality-photorealistic-19489550/
a commercial foundation,a commercial enterprise working on manufacturing prefabricated houses,Building Architecture,2 days left,$391 Avg Bid,10 bids,https://www.freelancer.com/projects/building-architecture/commercial-foundation/
interior design for small Coffee Shop,"hi I need to make a mode board for coffee shop similar of Costa or Starbucks with some changes, and selling our sweets products, this is just for a presentation,not if possible to make 3D presentation will be advantage",Building Architecture,2 days left,$130 Avg Bid,76 bids,https://www.freelancer.com/projects/threed-modelling/interior-design-for-small-coffee/
Convert PDFs to DWG to Standard,"I required 14 drawings converted from PDF to DWG. I then require the drawing to be assigned to correct layers, this company standard I will pass on to the approved Freelancer. Essentially these drawings are required for a facade client and the majority of the layers would need to be merged. I also will require the majority of the text to be deleted. Files will need to be supplied back in Autoca...",Building Architecture,2 days left,$125 Avg Bid,123 bids,https://www.freelancer.com/projects/autocad/convert-pdfs-dwg-standard/
Toilet Layout Design 3D,"Hi, I need someone to create a 3D Layout design of our toilet container. It includes 5 five toilets, 2 sinks and a turnstile, that would need to be digitally included. More or less an architectual drawing, but in 3D so we can use it in presentations. Container dimensions 6.06m x 2.44x2.59 (length x width x height) I added the basic layout of the container from bird eyes. I added the tur...",Building Architecture,2 days left,$65,20 entries,https://www.freelancer.com/contest/toilet-layout-design-d-1499153.html
civil engineer,attachment will be share with you please bid so that we can discuss on it,Building Architecture,2 days left,$16 Avg Bid,22 bids,https://www.freelancer.com/projects/engineering/civil-engineer-19487225/
3D Design + 2D dimensions,"I am building my house and would like to design the inside areas such as ( living room, bedroom, bathroom, ETC .. ), searching for a 3D designer can provide me with all details so I can construct my work easily.",Building Architecture,2 days left,$206 Avg Bid,50 bids,https://www.freelancer.com/projects/threed-modelling/design-dimensions/
construction - civil,construction attachment will be given,Building Architecture,2 days left,$18 Avg Bid,13 bids,https://www.freelancer.com/projects/engineering/construction-civil/
VERTEX BD house plan,We are looking for long term partnership for an experienced Vertex BD expert.,Building Architecture,2 days left,$245 Avg Bid,4 bids,https://www.freelancer.com/projects/building-architecture/vertex-house-plan/
Home Architect,looking for a freelance architect,Building Architecture,2 days left,$307 Avg Bid,41 bids,https://www.freelancer.com/projects/building-architecture/home-architect/
Landscaping a slope in the front yard (no retaining wall allowed),"Hi, I'd like to get some suggestions on landscaping a slope with stairs around it. This area is at the front of our house. No retaining wall was allowed by the city (permit issue). The dimensions requirements are in the photo. I'm looking for sketches with technical information on how to implement it. Current landscaping ties have to be removed and slope modified. * A retaining wall ...",Building Architecture,4 days left,$40,11 entries,https://www.freelancer.com/contest/landscaping-a-slope-in-the-front-yard-no-retaining-wall-allowed-1499022.html
"AutoCad, AutoCad","AutoCad, AutoCad, AutoCad, AutoCad",Building Architecture,2 days left,$26 Avg Bid,75 bids,https://www.freelancer.com/projects/autocad/autocad-autocad/
Structural Engineer-Draftman Have Dm Approved,"Dear Concern Iam Structural Engineer With 6 Years Experience. Iam Approved From Dm Municipality G+4 I searching about Freelancer Work Design and Analysis and drafting Using ACI , BSS And UBC 97 CODE. If You Have Any Project Connect Me.",Building Architecture,1 day left,$411 Avg Bid,5 bids,https://www.freelancer.com/projects/autocad/structural-engineer-draftman-have/
I need an architectural designer to creat Screen Porch plans to submit for building permit,I need customized architectural plans for a 14' x 16' screen room that is attached to the back of my house. I have a very good idea of what I want just need architectural drawings that include electrical and meet Lake County IL codes.,Building Architecture,1 day left,$157 Avg Bid,20 bids,https://www.freelancer.com/projects/autocad/need-architectural-designer-creat-screen/
3 d design for hotel lobby,I am looking for a experienced designer to design a Hotel lobby . I would like to see some of your past work to prove your [login to view URL],Building Architecture,1 day left,$382 Avg Bid,49 bids,https://www.freelancer.com/projects/graphic-design/design-for-hotel-lobby/
Renderings,"As part of my profession in interior design, I will need professional and realistic looking renderings. Now, being in the midst of a specific project, the rendering will need to reference real materials, colors and lighting. This is a single floor, multi room apartment.",Building Architecture,1 day left,$443 Avg Bid,85 bids,https://www.freelancer.com/projects/threed-modelling/renderings-19479204/
Land and Topography Survey,Land and topo survey needs to be performed for residential construction build.,Building Architecture,1 day left,$333 Avg Bid,12 bids,https://www.freelancer.com/projects/threed-modelling/land-topography-survey/
auto cad designers,make construction drawings using auto cad or solid works,Building Architecture,1 day left,$13 / hr Avg Bid,72 bids,https://www.freelancer.com/projects/autocad/auto-cad-designers/
Plan Modifications,I have current home drawings that need to be modified. Extending a rear of a house with an addition of a garage. I have the original plans with CAD drawings along with PDFs,Building Architecture,1 day left,$330 Avg Bid,72 bids,https://www.freelancer.com/projects/threed-modelling/plan-modifications/
"MEP project for water, gas, fuel piping system",I have a multi-story building looking for fixing some boiler in its different floors.,Building Architecture,1 day left,$471 Avg Bid,21 bids,https://www.freelancer.com/projects/autocad/mep-project-for-water-gas/
"INTERIOR DESIGN of an apartment, 29 m2 at the edge of the sea.","Inside a small apartment at the seaside to transform, develop. The apartment of 29 m2 has a bathroom with toilet, a bedroom, a living room with kitchenette. The surface is small, it must be optimized for optimal comfort with many storage spaces. The kitchenette today is in the main room, so the water supply and evacuation for this part are here, see map. Only an architect could say it but I...",Building Architecture,9 days left,$561,36 entries,https://www.freelancer.com/contest/interior-design-of-an-apartment-m-at-the-edge-of-the-sea-1498707.html
Planning row houses in a open plot,"I have open plot in a residential area. I need full planning of row houses in area of 5000 sqft with each unit approx 450-550 sqft. Or as suitable. With some basic amneties like parking ,small park/ garden,",Building Architecture,9 days left,$14,3 entries,https://www.freelancer.com/contest/planning-row-houses-in-a-open-plot-1498695.html
Small Office Layout/Designs,"Hi..I just need to get some idea for a small office layout. I have few drawings with dimensions. If you have better ideas, you will be the winner.",Building Architecture,1 day left,$50,9 entries,https://www.freelancer.com/contest/small-office-layoutdesigns-1498677.html
Source Controlled Drawings,We have some products that we sell and we are looking to make those into detailed source controlled drawing showing all dimensions and other necessary specs. Please show me past source controlled drawings you have done. Thank you,Building Architecture,1 day left,$19 / hr Avg Bid,20 bids,https://www.freelancer.com/projects/threed-modelling/source-controlled-drawings/
Interior Design for my home - 3D rendering,"Need a professional to help me design interiors for my new house in Delhi India. Just need help with flooring and wall colour scheme for bedrooms, living room, bathrooms, modular kitchen etc. The building is G+3 Floors, Ground and Upper Ground for my personal use and the top 2 floors for rental purpose.",Building Architecture,1 day left,$3582 Avg Bid,52 bids,https://www.freelancer.com/projects/threed-modelling/interior-design-for-home-rendering/
cottage heating project,"I will execute the project of heating and water supply and sewage of your house The project includes the calculation of heat loss, selection of boiler power, calculation of TP contours, hydraulic calculation taking into account the balancing of the heating system, floor plans drawings, axonometry of the heating system and placement of boiler room equipment, equipment specification. I will assess t...",Building Architecture,1 day left,$12 / hr Avg Bid,9 bids,https://www.freelancer.com/projects/autocad/cottage-heating-project/
Construction Level Architectural Documentation,"We have this project already through Planning Consent, but need to convert these into full Construction Documentation sets. 2x townhouses We will be looking for the following for each house: Site plan Ground floor plan First floor plan (where appropriate) External elevations x4 Sections x2 Roof plan Drainage plan Electrical Plan Plumbing/gas plan (nominal placements) Internal elevations of all...",Building Architecture,1 day left,$400 Avg Bid,44 bids,https://www.freelancer.com/projects/building-architecture/construction-level-architectural/
Repair or replace pvc water on/off valve,"Repair or replace pvc water on/off valve for exterior water in small residential house. When level turned to open position, water sprays from level itself.",Building Architecture,1 day left,$95 Avg Bid,6 bids,https://www.freelancer.com/projects/threed-modelling/repair-replace-pvc-water-off/
